{
  "schemaVersion": "5.0",
  "workflowId": "CG-JOBS-PROD-V5",
  "runId": "CG-2026-08-27-A1-fixture1",
  "runGroupKey": "CG-2026-08-27",
  "targetAsOfDate": "2026-08-27",
  "partitionId": 2,
  "status": "SUCCESS",
  "sources": ["Fixture Official Careers B"],
  "startedAt": "2026-08-27T09:00:00.000Z",
  "completedAt": "2026-08-27T09:01:10.000Z",
  "exportedAt": "2026-08-27T09:01:10.000Z",
  "rowCount": 1,
  "items": [
    {
      "id": "fixture-job-b",
      "canonicalJobKey": "source:careers-b.example:202",
      "fingerprint": "fixture-fingerprint-b",
      "sourceUrl": "https://careers-b.example/jobs/202",
      "sourceName": "Fixture Official Careers B",
      "sourcePostingId": "202",
      "companyName": "예시테크 B",
      "companySize": "MID",
      "companySizeEvidence": "비식별 테스트 근거",
      "title": "신입 프론트엔드 개발자",
      "category": "프론트엔드",
      "careerScope": "NEW_GRAD_ELIGIBLE",
      "careerEvidence": "경력무관 지원 가능 문구를 확인한 비식별 fixture",
      "employmentType": "FULL_TIME",
      "region": "경기",
      "remote": false,
      "techStack": ["JavaScript"],
      "publishedAt": "2026-08-27T00:00:00.000Z",
      "applicationStartAt": "2026-08-27T00:00:00.000Z",
      "deadlineAt": "2026-09-29T14:59:59.000Z",
      "rolling": false,
      "summary": "비식별 통합 테스트 공고",
      "status": "ACTIVE",
      "collectedAt": "2026-08-27T09:00:00.000Z",
      "lastVerifiedAt": "2026-08-27T09:00:40.000Z",
      "createdAt": "2026-08-27T09:01:10.000Z",
      "updatedAt": "2026-08-27T09:01:10.000Z"
    }
  ],
  "errorCode": null,
  "errorMessage": null
}
