{
  "schemaVersion": "5.0",
  "workflowId": "CG-JOBS-PROD-V5",
  "runId": "CG-2026-08-27-A1-fixture1",
  "runGroupKey": "CG-2026-08-27",
  "targetAsOfDate": "2026-08-27",
  "partitionId": 1,
  "status": "SUCCESS",
  "sources": ["Fixture Official Careers A"],
  "startedAt": "2026-08-27T09:00:00.000Z",
  "completedAt": "2026-08-27T09:01:00.000Z",
  "exportedAt": "2026-08-27T09:01:00.000Z",
  "rowCount": 1,
  "items": [
    {
      "id": "fixture-job-a",
      "canonicalJobKey": "source:careers-a.example:101",
      "fingerprint": "fixture-fingerprint-a",
      "sourceUrl": "https://careers-a.example/jobs/101",
      "sourceName": "Fixture Official Careers A",
      "sourcePostingId": "101",
      "companyName": "예시테크 A",
      "companySize": "LARGE",
      "companySizeEvidence": "비식별 테스트 근거",
      "title": "신입 백엔드 개발자",
      "category": "백엔드",
      "careerScope": "NEW_GRAD_ONLY",
      "careerEvidence": "신입 지원 가능 문구를 확인한 비식별 fixture",
      "employmentType": "FULL_TIME",
      "region": "서울",
      "remote": false,
      "techStack": ["Java"],
      "publishedAt": "2026-08-27T00:00:00.000Z",
      "applicationStartAt": "2026-08-27T00:00:00.000Z",
      "deadlineAt": "2026-09-30T14:59:59.000Z",
      "rolling": false,
      "summary": "비식별 통합 테스트 공고",
      "status": "ACTIVE",
      "collectedAt": "2026-08-27T09:00:00.000Z",
      "lastVerifiedAt": "2026-08-27T09:00:30.000Z",
      "createdAt": "2026-08-27T09:01:00.000Z",
      "updatedAt": "2026-08-27T09:01:00.000Z"
    }
  ],
  "errorCode": null,
  "errorMessage": null
}
